CL_CD,CL_NM,AREA_NM,ADDR,BASE_YEAR,BASE_MT,ALL_TOTAL_CO,MON_VIEWS_CO,TUES_VIEWS_CO,WED_VIEWS_CO,THUR_VIEWS_CO,FRI_VIEWS_CO,SAT_VIEWS_CO,SUN_VIEWS_CO
c3,숙박,솔바람풍경소리펜션,제주특별자치도 서귀포시 남원읍 태수로143번길 132-37,2023,05,43,7,12,4,5,5,1,9
c3,숙박,송림원,제주특별자치도 제주시 애월읍 천덕로 313-3,2023,05,38,3,9,5,5,5,3,8
c3,숙박,쇠소깍섬도리왓펜션,서귀포시 효돈순환로 217-3,2023,05,43,15,9,4,5,4,2,4
c3,숙박,쇠소깍올레민박,제주특별자치도 서귀포시 효돈로204번길 23,2023,05,29,1,9,8,2,3,3,3
c3,숙박,수상한소금밭게스트하우스,제주특별자치도 제주시 구좌읍 종달동길 36-10,2023,05,53,9,10,11,2,6,3,12
c3,숙박,수앤수가족호텔,제주시 애월읍 부룡수길 60,2023,05,31,6,6,3,4,4,3,5
c3,숙박,수필하우스,제주특별자치도 제주시 구좌읍 종달논길 50-1,2023,05,29,3,9,5,4,4,0,4
c3,숙박,수하리839,제주특별자치도 서귀포시 성산읍 온평애향로 21,2023,05,35,3,10,5,3,4,3,7
c3,숙박,숨비아일랜드,제주특별자치도 서귀포시 성산읍 신천서로 91,2023,05,27,3,4,3,4,6,3,4
c3,숙박,숲골 제주독채펜션,제주특별자치도 제주시 조천읍 선교로 211-19,2023,05,39,4,7,9,6,6,4,3
c3,숙박,쉴띠펜션&게스트하우스,제주특별자치도 서귀포시 안덕면 한창로 104,2023,05,15,0,3,0,6,2,1,3
c3,숙박,쉴만한 물가,제주특별자치도 제주시 한림읍 월령안길 28,2023,05,60,9,15,4,8,9,4,11
c3,숙박,쉼게스트하우스,제주특별자치도 제주시 한림읍 옹포2길 30,2023,05,30,2,8,6,4,4,2,4
c3,숙박,쉼멍스테이,제주특별자치도 서귀포시 대정읍 신영로 16-14,2023,05,45,5,12,10,7,4,4,3
c3,숙박,스마일모텔,제주특별자치도 제주시 연동13길 42,2023,05,21,1,6,0,6,3,4,1
c3,숙박,스머프하우스,제주특별자치도 서귀포시 천제연로 127-1,2023,05,25,3,2,4,5,5,3,3
c3,숙박,스위트모텔,제주특별자치도 제주시 삼무로3길 9,2023,05,34,2,4,7,12,3,4,2
c3,숙박,스위트호텔 제주,제주특별자치도 서귀포시 중문관광로72번길 67,2023,05,36,5,10,2,9,4,4,2
c3,숙박,스카이리더스호텔,제주특별자치도 제주시 신광로 106,2023,05,12,0,1,0,9,0,2,0
c3,숙박,스카이워커,제주특별자치도 제주시 관덕로13길 11,2023,05,12,3,1,2,5,0,1,0
c3,숙박,스쿠버스토리,제주특별자치도 서귀포시 태평로536번길 17,2023,05,13,2,3,1,6,0,1,0
c3,숙박,스테이달하,제주특별자치도 제주시 애월읍 신엄안1길 20,2023,05,47,2,13,4,12,5,5,6
c3,숙박,스테이지게스트하우스,제주특별자치도 제주시 구좌읍 해맞이해안로 2361,2023,05,35,4,5,9,7,2,4,4
c3,숙박,스토리인제주게스트하우스,제주특별자치도 제주시 중앙로12길 5,2023,05,33,6,5,6,4,4,3,5
c3,숙박,스토리하우스펜션,제주특별자치도 제주시 도리중길 37,2023,05,21,4,5,2,5,1,3,1
c3,숙박,스톤성민박,제주특별자치도 서귀포시 일주서로 866,2023,05,18,1,0,2,8,2,3,2
c3,숙박,스프링데일골프앤리조트,제주특별자치도 서귀포시 남원읍 서성로 459,2023,05,19,2,4,3,6,2,1,1
c3,숙박,슬로우리제주 민박,제주특별자치도 제주시 애월읍 엄수로 77,2023,05,50,7,5,8,9,3,7,11
c3,숙박,슴게스트하우스 제주공항점,제주특별자치도 제주시 서광로5길 2-2,2023,05,22,5,4,1,7,1,2,2
c3,숙박,시땅,제주특별자치도 제주시 애월읍 고내북동길 47,2023,05,21,3,5,1,7,2,1,2
c3,숙박,시루네펜션,제주특별자치도 서귀포시 검은여로 79,2023,05,31,8,6,5,3,5,1,3
c3,숙박,시월애,제주특별자치도 서귀포시 대정읍 무릉사장로 154,2023,05,22,2,4,2,6,0,5,3
c3,숙박,신강남모텔,제주특별자치도 제주시 서광로3길 2,2023,05,28,3,5,4,10,1,3,2
c3,숙박,신등대민박,제주특별자치도 제주시 추자면 추자로 12,2023,05,18,2,2,0,5,4,5,0
c3,숙박,신라스테이 제주,제주특별자치도 제주시 노연로 100,2023,05,69,8,16,14,10,3,7,11
c3,숙박,신라호텔제주,제주도 서귀포시 중문관광로 72번길 75,2023,05,187,25,43,37,16,23,21,22
c3,숙박,신산게스트하우스,제주특별자치도 서귀포시 성산읍 환해장성로121번길 21,2023,05,13,2,3,2,3,1,1,1
c3,숙박,신촌돌집,제주특별자치도 제주시 조천읍 신촌5길 30,2023,05,62,8,7,8,13,11,8,7
c3,숙박,신화관 제주신화월드 호텔 앤 리조트,제주특별자치도 서귀포시 안덕면 신화역사로304번길 38 신화관 제주신화월드 호텔 앤 리조트,2023,05,48,6,7,5,12,4,5,9
c3,숙박,신흥소시민,제주특별자치도 제주시 조천읍 신흥로1길 21,2023,05,21,5,4,4,2,4,1,1
c3,숙박,실크로드펜션,제주특별자치도 제주시 용해로 21-6,2023,05,22,1,3,4,6,3,2,3
c3,숙박,심스호텔,제주특별자치도 제주시 임항로 249,2023,05,15,2,6,1,2,1,2,1
c3,숙박,썬라이즈호텔,제주특별자치도 서귀포시 중문관광로 310,2023,05,27,2,5,4,6,3,4,3
c3,숙박,썬레이크빌제주,제주특별자치도 서귀포시 성산읍 한도로 49,2023,05,36,2,8,7,11,2,2,4
c3,숙박,썬베이펜션,제주특별자치도 제주시 서흘길 14,2023,05,10,0,2,3,2,1,1,1
c3,숙박,썬비치리조트,제주특별자치도 제주시 서해안로 114,2023,05,40,8,7,7,7,5,1,5
c3,숙박,썬비치민박,제주특별자치도 제주시 우도면 우도해안길 810,2023,05,25,5,4,2,4,4,6,0
c3,숙박,썬앤문리조트,제주특별자치도 서귀포시 안덕면 사계남로 102,2023,05,77,11,9,13,10,12,13,9
c3,숙박,쏠레 민박,제주특별자치도 서귀포시 성산읍 성산등용로 96-1,2023,05,31,10,5,5,4,3,1,3
c3,숙박,씨사이드아덴,제주특별자치도 서귀포시 중문관광로 124,2023,05,45,7,8,10,10,3,3,4
c3,숙박,씨스테이 리틀해녀 블루,제주특별자치도 제주시 용마로4길 15,2023,05,16,5,0,2,4,0,4,1
c3,숙박,씨스테이호텔,제주특별자치도 제주시 애월읍 애월해안로 255,2023,05,25,4,1,10,3,2,1,4
c3,숙박,씨앤관광호텔,제주특별자치도 제주시 일주서로 7490,2023,05,25,5,0,4,11,3,1,1
c3,숙박,씨앤하우스,제주특별자치도 제주시 조천읍 조천9길 10,2023,05,44,9,12,6,5,3,5,4
c3,숙박,씨에스호텔앤리조트,제주특별자치도 서귀포시 중문관광로 198,2023,05,118,17,25,23,18,13,9,13
c3,숙박,씨엘블루호텔,제주특별자치도 제주시 서해안로 368-3,2023,05,24,4,6,3,5,1,3,2
c3,숙박,씨오르리조트,제주특별자치도 서귀포시 이어도로 989,2023,05,62,10,11,11,8,6,8,8
c3,숙박,씨제이 관광호텔,제주특별자치도 제주시 광양8길 24,2023,05,20,2,2,4,5,3,1,3
c3,숙박,아델리아빌,제주특별자치도 제주시 내도9길 8-15,2023,05,27,0,6,4,11,3,0,3
c3,숙박,아뜨네통나무펜션,제주특별자치도 제주시 애월읍 상하귀길 91,2023,05,31,7,2,5,9,1,1,6
c3,숙박,아띠랑스호텔,제주특별자치도 서귀포시 성산읍 해맞이해안로 2614,2023,05,21,0,7,3,7,0,1,3
c3,숙박,아름다운리조트,제주특별자치도 서귀포시 성산읍 해맞이해안로 2644,2023,05,38,8,6,8,4,3,7,2
c3,숙박,아름다운펜션민박,제주특별자치도 제주시 추자면 영흥4길 62,2023,05,47,14,7,5,4,9,4,4
c3,숙박,아리스토캣펜션,제주특별자치도 제주시 서해안로 518,2023,05,40,7,2,6,14,5,2,4
c3,숙박,아림민박,제주특별자치도 제주시 서해안로 456-8,2023,05,40,9,5,9,7,2,4,4
c3,숙박,아마빌레,제주특별자치도 제주시 애월읍 애월해안로 909,2023,05,29,4,4,3,6,6,3,3
c3,숙박,아모렉스리조트,제주특별자치도 제주시 서해안로 216,2023,05,43,6,9,5,13,5,1,4
c3,숙박,아모르하우스,제주특별자치도 제주시 구좌읍 해맞이해안로 2060-18,2023,05,28,4,6,6,6,3,1,2
c3,숙박,아스타호텔,제주특별자치도 제주시 서사로 129,2023,05,35,4,5,9,6,4,2,5
c3,숙박,아올키즈펜션,제주특별자치도 서귀포시 안덕면 사계중앙로 13-15,2023,05,47,11,8,7,7,5,3,6
c3,숙박,아이랑키즈펜션,제주특별자치도 제주시 애월읍 고내로7길 34,2023,05,275,54,51,40,39,37,23,31
c3,숙박,아이미 제주비치 호텔,제주특별자치도 제주시 조천읍 조함해안로 474,2023,05,26,3,1,2,8,8,0,4
c3,숙박,아이비테라스,제주특별자치도 서귀포시 법환상로 65,2023,05,57,11,8,9,11,7,6,5
c3,숙박,아이존호텔,제주특별자치도 제주시 신광로4길 18,2023,05,14,1,2,1,7,1,0,2
c3,숙박,아이콘민박,제주특별자치도 제주시 추자면 신양서길 42-17,2023,05,12,2,0,2,2,1,4,1
c3,숙박,아이콘펜션,제주특별자치도 제주시 추자면 신양서길 42,2023,05,28,4,5,5,5,3,3,3
c3,숙박,아인피플호텔,제주특별자치도 제주시 논세길 51,2023,05,22,5,4,1,4,1,4,3
c3,숙박,아침의 새소리,제주특별자치도 서귀포시 남원읍 태수로358번길 3-1,2023,05,49,4,6,6,15,6,7,5
c3,숙박,아침의향기,제주특별자치도 서귀포시 색달중앙로 122,2023,05,21,5,2,5,1,2,3,3
c3,숙박,아침해변,제주특별자치도 제주시 조천읍 조함해안로 76-9,2023,05,23,6,3,1,6,2,2,3
c3,숙박,아쿠아뷰티크,제주특별자치도 제주시 구좌읍 해맞이해안로 526,2023,05,24,3,5,9,3,3,0,1
c3,숙박,아템파우제,제주특별자치도 제주시 한림읍 월림8길 21,2023,05,20,2,4,2,1,6,1,4
c3,숙박,아토하우스,제주특별자치도 서귀포시 남원읍 신흥앞동산로 84,2023,05,12,3,2,0,5,0,0,2
c3,숙박,아트모텔,제주특별자치도 제주시 신대로20길 48,2023,05,26,6,1,5,7,4,1,2
c3,숙박,아프리카게스트하우스,제주특별자치도 제주시 조천읍 신흥로2길 33,2023,05,24,5,4,3,5,2,3,2
c3,숙박,안녕김녕sea,제주특별자치도 제주시 구좌읍 구좌해안로 178,2023,05,58,7,13,8,13,10,3,4
c3,숙박,안녕프로젝트 게스트하우스,제주특별자치도 제주시 구좌읍 동복로2길 12,2023,05,12,2,1,2,3,1,2,1
c3,숙박,안트레 펜션,제주특별자치도 제주시 한림읍 한림중앙로 154-7,2023,05,32,3,4,3,8,6,4,4
c3,숙박,알랑가게스트하우스,제주특별자치도 서귀포시 안덕면 사계남로153번길 2,2023,05,24,6,4,0,8,1,3,2
c3,숙박,알로하민박,제주특별자치도 제주시 한림읍 협재1길 24,2023,05,23,1,1,3,7,2,4,5
c3,숙박,알앤비타운,제주특별자치도 서귀포시 분토왓로174번길 45,2023,05,27,3,8,4,7,1,2,2
c3,숙박,애월포구풍경,제주특별자치도 제주시 애월읍 애월로11길 18,2023,05,45,8,8,7,10,4,4,4
c3,숙박,애월해안누리펜션(구 하얀둥지펜션),제주특별자치도 제주시 애월읍 애월해안로 298,2023,05,59,8,9,6,15,3,8,10
c3,숙박,야스라기펜션,제주특별자치도 제주시 애월읍 상귀서길 82-34,2023,05,26,3,6,1,8,2,0,6
c3,숙박,야크마을,제주특별자치도 서귀포시 색달중앙로 162,2023,05,114,21,19,22,11,13,13,15
c3,숙박,야호비치하우스,제주특별자치도 제주시 조천읍 조함해안로 582,2023,05,57,13,10,8,9,7,7,3
c3,숙박,약천골민박,제주특별자치도 서귀포시 이어도로 303,2023,05,17,1,1,3,4,1,5,2
c3,숙박,언니게스트하우스,제주특별자치도 제주시 구좌읍 대수길 10-12,2023,05,19,4,4,2,6,2,1,0
c3,숙박,언니네여인숙,제주특별자치도 제주시 구좌읍 종달논길 54,2023,05,65,9,10,10,11,9,11,5
c3,숙박,언덕위에 빨간지붕,제주특별자치도 서귀포시 성산읍 난고로499번길 17,2023,05,46,11,9,7,6,8,2,3
c3,숙박,엄블랑펜션,제주특별자치도 서귀포시 안덕면 형제해안로132번길 15-24,2023,05,34,5,5,6,8,3,3,4
c3,숙박,에너벨리민박,제주특별자치도 제주시 한림읍 한림로 356,2023,05,34,2,6,3,8,1,5,9
c3,숙박,에띠에리조트,제주특별자치도 서귀포시 이어도로 738,2023,05,22,1,3,2,6,4,3,3
c3,숙박,에리두 Cafe n Beds,제주특별자치도 서귀포시 대포복개로 37,2023,05,43,4,8,8,5,2,9,7
c3,숙박,에바다라이더하우스.공방,제주특별자치도 서귀포시 성산읍 고성중앙로 7-8,2023,05,21,4,2,5,4,3,1,2
c3,숙박,에스호텔,제주특별자치도 제주시 오일장중길 26,2023,05,19,3,3,4,3,3,0,3
c3,숙박,에이지하우스,제주특별자치도 서귀포시 표선면 돈오름로23번길 36-46,2023,05,21,2,5,2,6,1,4,1
c3,숙박,에이티눈호텔,제주특별자치도 제주시 은남1길 8,2023,05,36,9,7,7,3,7,0,3
c3,숙박,에코그린리조트,제주특별자치도 제주시 한림읍 귀덕6길 94,2023,05,63,10,12,8,9,5,9,10
c3,숙박,에코하우스민박펜션,제주특별자치도 제주시 추자면 추자로 657,2023,05,40,6,10,6,4,10,2,2
c3,숙박,에쿠스모텔,제주특별자치도 서귀포시 안덕면 화순중앙로54번길 5,2023,05,49,7,11,2,5,6,10,8
c3,숙박,에퀴녹스 드 협재,제주특별자치도 제주시 한림읍 협재10길 4,2023,05,25,3,7,4,2,4,3,2
c3,숙박,엔젤하우스,제주특별자치도 제주시 애월읍 신엄안3길 95,2023,05,38,7,3,6,7,5,3,7
c3,숙박,엘마르게스트하우스,제주특별자치도 서귀포시 표선면 표선당포로 17,2023,05,27,5,7,4,6,2,2,1
c3,숙박,엘쯔타운펜션,제주특별자치도 제주시 애월읍 유수암평화길 136,2023,05,22,0,4,3,7,2,2,4
c3,숙박,엠버관광호텔,제주특별자치도 제주시 삼무로 12 (연동),2023,05,8,0,1,2,2,0,1,2
c3,숙박,엠버리조트,제주특별자치도 제주시 1100로 2671-51,2023,05,12,2,0,2,5,1,1,1
c3,숙박,엠버하우스,제주특별자치도 제주시 애월읍 애월해안로 400,2023,05,16,2,2,1,4,4,0,3
c3,숙박,엠버호텔 센트럴,제주특별자치도 제주시 노연로 24,2023,05,26,5,3,2,4,3,4,5
c3,숙박,엠스테이호텔,제주특별자치도 서귀포시 태평로353번길 14,2023,05,30,4,9,4,5,1,2,5
c3,숙박,여래게스트하우스,제주특별자치도 제주시 구좌읍 세화7길 31-2,2023,05,32,5,6,5,8,1,3,4
c3,숙박,여울목게스트하우스(월정리),제주특별자치도 제주시 구좌읍 월정중길 51,2023,05,76,12,12,10,16,14,8,4
c3,숙박,여정여관,제주특별자치도 제주시 추자면 추자로 4-1,2023,05,49,4,15,7,5,9,6,3
c3,숙박,여행스케치,제주특별자치도 서귀포시 일주서로 694,2023,05,29,3,4,4,10,4,2,2
c3,숙박,연이네다락방 게스트하우스,제주특별자치도 제주시 구좌읍 동복로 56-3,2023,05,46,10,3,5,8,6,9,5
c3,숙박,연지민박,제주특별자치도 제주시 우도면 상우목길 26,2023,05,34,7,4,7,6,3,4,3
c3,숙박,예다움휴양펜션,제주특별자치도 제주시 백포북길 25,2023,05,18,1,3,1,7,3,0,3
c3,숙박,예스준게스트하우스,제주특별자치도 제주시 서해안로 232 (도두일동),2023,05,18,3,2,1,5,1,2,4
c3,숙박,예이츠산장,서귀포시 남원읍 516로 918,2023,05,37,3,13,5,9,1,1,5
c3,숙박,예촌민박,서귀포시 남원읍 중산간동로 7126,2023,05,69,11,18,10,7,4,7,12
c3,숙박,옛마을펜션,제주특별자치도 서귀포시 검은여로 80,2023,05,31,5,3,5,5,2,7,4
c3,숙박,옛살라비,제주특별자치도 제주시 애월읍 광령8길 47,2023,05,15,3,1,3,3,1,1,3
c3,숙박,오누게스트하우스,제주특별자치도 제주시 애월읍 애월로2길 7,2023,05,31,8,4,3,9,1,2,4
c3,숙박,오랑제리펜션,제주특별자치도 서귀포시 법환상로2번길 58,2023,05,26,6,3,6,4,2,3,2
c3,숙박,오렌지트리 호텔,제주특별자치도 제주시 관덕로8길 7-12,2023,05,13,2,0,1,4,0,4,2
c3,숙박,오름게스트하우스,제주특별자치도 제주시 구좌읍 충렬로 147-19,2023,05,85,13,17,8,14,14,12,7
c3,숙박,오비두스,제주특별자치도 제주시 애월읍 신엄안3길 138,2023,05,26,1,2,6,11,3,0,3
c3,숙박,오빌하우스,제주특별자치도 서귀포시 남원읍 공천포로11번길 15,2023,05,16,4,0,1,7,2,1,1
c3,숙박,오션갤러리호텔앤리조트,"제주특별자치도 서귀포시 성산읍 환해장성로 231 (신산리, 오션 갤러리 프리미어 빌라스 2단지)",2023,05,54,19,13,8,4,2,3,5
c3,숙박,오션그랜드호텔 (함덕),제주특별자치도 제주시 조천읍 조함해안로 490,2023,05,33,9,5,3,8,5,1,2
c3,숙박,오션스위츠호텔 제주,제주특별자치도 제주시 탑동해안로 74,2023,05,51,9,8,7,14,3,4,6
c3,숙박,오션스카이,제주특별자치도 제주시 구좌읍 덕행로 450-15,2023,05,20,1,7,5,2,3,1,1
c3,숙박,오션스퀘어,서귀포시 환해장성로 667,2023,05,75,13,12,11,13,12,8,6
c3,숙박,오션트리,제주특별자치도 서귀포시 월드컵로 188,2023,05,22,1,4,6,3,0,5,3
c3,숙박,오션패밀리호텔,제주특별자치도 제주시 일주서로 7531,2023,05,17,4,2,1,5,2,1,2
c3,숙박,오시록헌펜션,제주특별자치도 제주시 한림읍 금능6길 8,2023,05,34,3,3,6,6,4,6,6
c3,숙박,오조리비앤비(Ojoribnb),제주특별자치도 서귀포시 성산읍 오조로 42,2023,05,40,9,6,9,8,1,3,4
c3,숙박,오크하우스,제주특별자치도 제주시 애월읍 하가로 13,2023,05,57,10,15,9,6,4,3,10
c3,숙박,오후여섯시펜션,제주특별자치도 제주시 애월읍 곽지9길 10,2023,05,20,3,3,3,5,1,2,3
c3,숙박,올레관광호텔,제주특별자치도 제주시 서광로 254,2023,05,15,0,7,2,2,0,0,4
c3,숙박,올레리조트,제주특별자치도 제주시 애월읍 부룡수길 33,2023,05,18,2,3,5,3,3,0,2
c3,숙박,올레스테이,제주특별자치도 서귀포시 중정로 22,2023,05,28,7,4,3,8,4,1,1
c3,숙박,올레요리조트,제주특별자치도 서귀포시 이어도로 720,2023,05,17,1,3,3,4,2,3,1
c3,숙박,올레프로방스,제주특별자치도 제주시 애월읍 광령평화2길 170-23,2023,05,15,4,0,3,4,0,2,2
c3,숙박,올레해오름펜션,제주특별자치도 제주시 애월읍 광령평화2길 142-19,2023,05,28,2,8,4,2,3,4,5
c3,숙박,올리수펜션,제주특별자치도 서귀포시 중문로5번길 16,2023,05,14,2,2,2,5,1,1,1
c3,숙박,와락 게스트하우스,제주특별자치도 제주시 구좌읍 세평항로 45-4,2023,05,45,8,6,9,6,2,9,5
c3,숙박,와이리조트 제주,제주특별자치도 서귀포시 안덕면 화순중앙로124번길 75,2023,05,48,8,7,10,10,2,4,7
c3,숙박,외돌개나라,제주특별자치도 서귀포시 남성로 122,2023,05,21,2,3,4,5,1,3,3
c3,숙박,용두암빌리지,제주특별자치도 제주시 용마서1길 27-5,2023,05,20,6,1,3,2,4,2,2
c3,숙박,용수차경,제주특별자치도 제주시 한경면 용수2길 7 (용수리) 용수 2길 7,2023,05,67,13,13,11,8,10,7,5
c3,숙박,우도사랑,제주특별자치도 제주시 우도면 우목길 82-2,2023,05,26,3,9,5,2,3,3,1
c3,숙박,우도쉼팡게스트하우스,제주특별자치도 제주시 우도면 우도로 7,2023,05,40,5,5,9,6,8,2,5
c3,숙박,우도올레펜션,제주특별자치도 제주시 우도면 전흘길 42,2023,05,33,2,8,8,2,4,5,4
c3,숙박,우도피아,제주특별자치도 제주시 우도면 영일진사길 51-40,2023,05,107,16,23,16,15,11,11,15
c3,숙박,우리두리게스트하우스,제주특별자치도 서귀포시 표선면 민속해안로119번길 10-1,2023,05,35,8,1,3,12,5,3,3
c3,숙박,우리희망이 게스트하우스,제주시 조천읍 신흥관전길 60-1,2023,05,49,6,10,5,12,8,4,4
c3,숙박,우연히 행복해지다,제주특별자치도 제주시 한림읍 한림로 224,2023,05,36,6,7,9,4,0,3,7
c3,숙박,월령지헌,제주특별자치도 제주시 한림읍 월령1길 13-5,2023,05,16,1,1,4,3,2,1,4
c3,숙박,월령채,제주특별자치도 제주시 한림읍 월령3길 27-5,2023,05,33,8,8,5,3,2,4,3
c3,숙박,월정소랑,제주특별자치도 제주시 구좌읍 월정1길 79-3,2023,05,33,8,5,4,9,3,1,3
c3,숙박,월정에비뉴,제주특별자치도 제주시 구좌읍 해맞이해안로 486,2023,05,58,10,8,6,13,7,6,8
c3,숙박,월정플레이스,제주특별자치도 제주시 구좌읍 월정1길 54-34,2023,05,31,6,4,5,8,2,5,1
c3,숙박,웨스티하우스,제주도 서귀포시 안덕면 일주서로 1488번길9,2023,05,26,4,5,5,3,2,5,2
c3,숙박,위더스펜션,제주시 애월읍 애월로 7길 24-3,2023,05,45,12,5,6,12,2,2,6
c3,숙박,위미모루왓,제주특별자치도 서귀포시 남원읍 위미항구로 51 (위미리),2023,05,27,7,6,5,3,2,2,2
c3,숙박,유니호텔제주,제주특별자치도 제주시 애월읍 애월해안로 656,2023,05,27,6,5,6,4,2,0,4
c3,숙박,유러하우스,제주특별자치도 서귀포시 막숙포로 136,2023,05,24,2,1,7,4,3,2,5
c3,숙박,유수암캠핑장,제주특별자치도 제주시 애월읍 하소로 684-25,2023,05,52,6,14,10,7,5,3,7
c3,숙박,유심이감성하우스민박,제주특별자치도 제주시 추자면 추자로 78,2023,05,126,34,21,13,17,20,11,10
c3,숙박,유앤아이게스트하우스,제주특별자치도 제주시 광양8길 1-2,2023,05,17,2,1,6,4,2,2,0
c3,숙박,유월그리고열두마루,제주특별자치도 제주시 구좌읍 한동로1길 38,2023,05,64,12,17,12,7,7,3,6
c3,숙박,유창민박,제주특별자치도 제주시 추자면 추자로 46-1,2023,05,10,4,2,0,1,2,1,0
c3,숙박,유탑유블레스호텔,제주특별자치도 제주시 조천읍 조함해안로 502,2023,05,32,3,7,6,7,5,1,3
c3,숙박,이디살래,제주특별자치도 서귀포시 안덕면 일주서로 2027,2023,05,33,3,3,3,10,4,5,5
c3,숙박,이디완,제주특별자치도 제주시 백포서3길 1,2023,05,20,3,1,3,5,2,2,4
c3,숙박,이디하우스n카페,제주특별자치도 제주시 구좌읍 해녀박물관길 33-2,2023,05,59,8,13,5,14,9,2,8
c3,숙박,이런날엔,제주특별자치도 제주시 구좌읍 한동북1길 60,2023,05,20,2,3,2,3,2,5,3
c3,숙박,이레민박,제주특별자치도 제주시 추자면 신양1길 22-9,2023,05,18,5,1,1,4,3,2,2
c3,숙박,이린펜션,제주특별자치도 서귀포시 일주서로43번길 5,2023,05,12,1,2,3,2,1,2,1
c3,숙박,이쁜새이쁘게노래하고펜션,제주특별자치도 제주시 한림읍 협재로 68-5,2023,05,38,6,6,10,3,0,7,6
c3,숙박,이안재,제주특별자치도 제주시 구좌읍 종달로5길 35-1 (종달리),2023,05,57,6,11,10,7,6,4,13
c3,숙박,이야기별방,제주특별자치도 제주시 구좌읍 해맞이해안로 2040,2023,05,21,3,3,3,7,2,2,1
c3,숙박,이어도펜션,제주특별자치도 제주시 도두항서5길 3,2023,05,25,0,2,5,8,5,2,3
c3,숙박,이찌마루&잠비,제주특별자치도 제주시 구좌읍 월정1길 54-11,2023,05,20,2,5,3,7,2,0,1
c3,숙박,인더 하우스,제주특별자치도 제주시 애월읍 엄장로 98-41,2023,05,34,2,6,4,9,1,4,8
c3,숙박,인추자커피앤민박,제주특별자치도 제주시 추자면 추자로 20-1,2023,05,27,7,2,4,3,3,7,1
c3,숙박,일레인호텔,"660, Iljuseo-ro, Seogwipo-si, Jeju-do",2023,05,35,1,7,7,7,8,3,2
c3,숙박,일출썬 펜션,제주특별자치도 서귀포시 성산읍 성산중앙로 67,2023,05,13,2,2,5,3,1,0,0
c3,숙박,임진고택,제주특별자치도 제주시 구좌읍 상도로 16-13,2023,05,39,4,9,9,4,4,4,5
c3,숙박,잇츠힐,제주특별자치도 제주시 애월읍 애월해안로 788,2023,05,24,0,3,8,2,2,5,4
c3,숙박,자넷앤캐시,제주시 구좌읍 평대9길 20-1,2023,05,17,3,5,4,3,1,0,1
c3,숙박,자연인,제주특별자치도 제주시 아란서길 110,2023,05,21,2,4,5,5,1,1,3
c3,숙박,장원민박,제주특별자치도 서귀포시 천제연로 49,2023,05,52,5,12,10,7,6,6,6
c3,숙박,저스트슬립제주,제주특별자치도 서귀포시 대정읍 무릉중앙로21번길 158-28,2023,05,15,3,0,2,5,0,1,4
c3,숙박,전원민박,제주특별자치도 제주시 우도면 우목길 104,2023,05,17,2,6,3,1,2,2,1
c3,숙박,절물길펜션,제주특별자치도 제주시 명림로 10-1,2023,05,22,5,3,2,6,4,1,1
c3,숙박,제니빌펜션,제주도 서귀포시 남원읍 태위로 604-15,2023,05,26,4,3,1,8,6,3,1
c3,숙박,제니아호텔,제주특별자치도 제주시 은남1길 25,2023,05,24,1,4,6,5,3,1,4
c3,숙박,제이드림호텔(jdream hotel),제주특별자치도 제주시 은남1길 40,2023,05,14,4,0,2,5,0,3,0
c3,숙박,제이앤클로이,제주특별자치도 서귀포시 대정읍 무릉중앙로 203,2023,05,32,5,7,1,7,4,4,4
c3,숙박,제주 리치호텔,제주특별자치도 제주시 애월읍 고내로13길 100,2023,05,35,9,6,3,5,3,6,3
c3,숙박,제주 메이 더 호텔 카라반빌리지,제주특별자치도 제주시 구좌읍 일주동로 1626,2023,05,47,10,12,8,3,2,3,9
c3,숙박,제주 벨루가,제주특별자치도 서귀포시 대정읍 영락하동로85번길 41-1,2023,05,38,3,5,5,11,7,3,4
c3,숙박,제주 에코 스위츠 펜션,제주특별자치도 서귀포시 중문상로 207-13,2023,05,151,29,23,19,22,27,10,21
c3,숙박,제주 오션팰리스 호텔,제주특별자치도 서귀포시 중앙로 14,2023,05,54,12,8,7,10,5,3,9
c3,숙박,제주bp게스트하우스 JEJU BP GUESTHOUSE,제주특별자치도 제주시 신대로17길 29,2023,05,38,4,7,5,11,7,1,3
c3,숙박,제주가온29,제주특별자치도 제주시 애월읍 중산간서로 5409,2023,05,32,10,0,4,5,6,2,5
c3,숙박,제주가좋아서 펜션,제주특별자치도 제주시 구좌읍 비자림로 1569,2023,05,242,45,38,35,30,30,28,36
c3,숙박,제주공항 고추잠자리 게스트하우스,제주특별자치도 제주시 도령로 190,2023,05,18,2,0,4,7,1,0,4
c3,숙박,제주금산펜션,제주특별자치도 제주시 애월읍 납읍로2길 40,2023,05,30,6,4,3,5,3,4,5
c3,숙박,제주나인 부띠끄,제주특별자치도 서귀포시 솔동산로10번길 23,2023,05,24,3,4,6,4,2,4,1
c3,숙박,제주나인리조트,제주특별자치도 제주시 해안마을북길 14-5,2023,05,15,2,2,1,4,2,2,2
c3,숙박,제주도 레인보우,제주특별자치도 제주시 구좌읍 종달로 68-2,2023,05,33,8,8,4,2,5,2,4
c3,숙박,제주도연게스트하우스,제주특별자치도 제주시 한림읍 일주서로 5673,2023,05,21,7,2,2,3,4,2,1
c3,숙박,제주도통나무펜션,제주특별자치도 서귀포시 남원읍 태위로 551-5,2023,05,18,2,1,2,6,3,1,3
c3,숙박,제주도푸른바다,제주도 제주시 구좌읍 별방길 109,2023,05,59,13,18,12,5,4,4,3
