CL_CD,CL_NM,AREA_NM,ADDR,BASE_YEAR,BASE_MT,ALL_TOTAL_CO,MON_VIEWS_CO,TUES_VIEWS_CO,WED_VIEWS_CO,THUR_VIEWS_CO,FRI_VIEWS_CO,SAT_VIEWS_CO,SUN_VIEWS_CO
c1,관광지,브랭섬홀아시아 아이스링크,제주특별자치도 서귀포시 대정읍 글로벌에듀로 234(3번게이트),2023,05,116,19,18,22,15,16,12,14
c1,관광지,(주)제주해양레저 투명카약,제주특별자치도 제주시 애월읍 애월로1길 22,2023,05,82,13,19,12,10,7,8,13
c1,관광지,1100고지(휴게소),제주특별자치도 서귀포시 1100로 1555,2023,05,412,67,66,71,54,50,35,69
c1,관광지,1100고지습지,제주특별자치도 서귀포시 색달동 산 1-2,2023,05,426,77,76,77,56,45,50,45
c1,관광지,1112도로,제주특별자치도 제주시 명림로 584 (봉개동),2023,05,36,8,3,6,8,4,5,2
c1,관광지,4·3해원방사탑,제주특별자치도 제주시 신산로 82,2023,05,50,12,11,3,7,5,7,5
c1,관광지,5.16도로숲터널,제주특별자치도 서귀포시 남원읍 신례리 산 2-1,2023,05,141,33,21,22,16,17,11,21
c1,관광지,9.81 파크,제주특별자치도 제주시 애월읍 천덕로 880-24,2023,05,490,98,100,80,56,49,44,63
c1,관광지,9연대 본부 옛터,제주특별자치도 서귀포시 대정읍 일주서로 2497,2023,05,77,12,17,7,7,15,9,10
c1,관광지,Cafe 몽스파,제주특별자치도 제주시 서사로 28,2023,05,39,6,5,5,7,5,7,4
c1,관광지,M1971 요트투어,제주특별자치도 서귀포시 대정읍 최남단해안로 128,2023,05,96,19,13,18,12,13,11,10
c1,관광지,SM 디지털아트 뮤지엄,제주특별자치도 제주시 애월읍 애월해안로 516-7,2023,05,121,19,18,22,19,13,12,18
c1,관광지,THE WE,제주특별자치도 서귀포시 1100로 453-95,2023,05,53,9,10,4,9,10,4,7
c1,관광지,WE호텔 웰니스센터,제주특별자치도 서귀포시 1100로 453-95,2023,05,217,29,25,44,47,29,16,27
c1,관광지,가마오름,제주특별자치도 제주시 한경면 청수서5길 63,2023,05,86,13,21,9,8,8,17,10
c1,관광지,가마오름 진지동굴,제주특별자치도 제주시 한경면 청수서5길 63,2023,05,136,18,19,21,18,18,13,29
c1,관광지,가메오름,제주특별자치도 제주시 애월읍 봉성리 산 125,2023,05,54,8,14,10,6,6,6,4
c1,관광지,가뫼물,제주특별자치도 서귀포시 남원읍 남위남성로 168,2023,05,290,44,75,36,50,34,28,23
c1,관광지,가문이오름(감은이오름),제주특별자치도 서귀포시 표선면 남조로 1487-73,2023,05,38,5,11,3,8,3,6,2
c1,관광지,가세오름,제주특별자치도 서귀포시 표선면 녹산로 554,2023,05,45,6,8,10,4,6,6,5
c1,관광지,가파도,제주특별자치도 서귀포시 대정읍 가파리,2023,05,1946,425,353,267,203,225,206,267
c1,관광지,가파도 마라도 정기여객선,제주특별자치도 서귀포시 대정읍 최남단해안로 120,2023,05,134,30,21,24,20,20,9,10
c1,관광지,가파초등학교 마라분교장,제주특별자치도 서귀포시 대정읍 마라로 58,2023,05,64,10,13,12,6,6,12,5
c1,관광지,각시바우오름,제주특별자치도 서귀포시 호근동 2112,2023,05,47,7,14,6,6,4,5,5
c1,관광지,간세공방,제주특별자치도 서귀포시 중정로 22,2023,05,94,12,25,12,20,6,10,9
c1,관광지,감귤박물관,제주특별자치도 서귀포시 효돈순환로 441,2023,05,293,53,45,63,48,29,24,31
c1,관광지,감귤박물관 월라봉 산책로 - 생이소리길,제주특별자치도 서귀포시 효돈순환로 441,2023,05,49,9,8,8,7,7,4,6
c1,관광지,감귤상웨빵 체험,제주특별자치도 서귀포시 남원읍 하례중앙로 95,2023,05,50,8,6,11,8,6,7,4
c1,관광지,감수굴 밭담길,제주특별자치도 제주시 구좌읍 평대7길 34,2023,05,64,12,12,10,11,4,6,9
c1,관광지,갑자기 히어로즈 벽화길,제주특별자치도 제주시 애월읍 금성1길 29-3,2023,05,60,8,14,9,4,9,9,7
c1,관광지,갓전시관[갓전수교육관],제주특별자치도 제주시 조천읍 남조로 1904,2023,05,154,20,29,43,22,11,10,19
c1,관광지,강병대교회,제주특별자치도 서귀포시 대정읍 상모대서로 43-3,2023,05,68,9,8,15,14,8,8,6
c1,관광지,강정어촌계,제주특별자치도 서귀포시 말질로 290,2023,05,91,22,15,17,10,10,5,12
c1,관광지,강정천유원지,제주특별자치도 서귀포시 강정통물로 (강정동),2023,05,116,24,18,18,13,19,11,13
c1,관광지,개떼목장,제주특별자치도 서귀포시 안덕면 평화로 486 (덕수리),2023,05,123,18,21,19,14,21,19,11
c1,관광지,개미남,제주특별자치도 제주시 구산로 26,2023,05,36,3,7,5,8,5,5,3
c1,관광지,개오름,제주특별자치도 서귀포시 표선면 성읍이리로57번길 162,2023,05,117,20,16,15,12,16,18,20
c1,관광지,개오리오름,제주특별자치도 제주시 봉개동,2023,05,49,7,16,4,6,5,8,3
c1,관광지,개인공간,제주특별자치도 제주시 매촌1길 3-1,2023,05,52,8,10,9,6,7,7,5
c1,관광지,갤러리2 중선농원,제주특별자치도 제주시 영평길 269,2023,05,67,12,15,8,11,9,8,4
c1,관광지,거린오름 (북오름),제주특별자치도 서귀포시 안덕면 동광리 산 94,2023,05,72,12,16,11,7,11,9,6
c1,관광지,거문오름(UNESCO 세계자연유산),제주특별자치도 제주시 조천읍 선교로 569-36,2023,05,1489,331,258,266,265,154,101,114
c1,관광지,거믄여해안경승지,제주특별자치도 서귀포시 516로,2023,05,45,11,10,6,6,5,2,5
c1,관광지,거슨새미오름,제주특별자치도 제주시 구좌읍 송당리 산 145,2023,05,155,25,27,26,17,16,24,20
c1,관광지,거인의 정원,제주특별자치도 제주시 대원길 58,2023,05,118,23,27,16,14,11,17,10
c1,관광지,거친오름,제주특별자치도 제주시 명림로 520 (봉개동),2023,05,97,21,17,15,10,11,13,10
c1,관광지,건강과성박물관,제주특별자치도 서귀포시 안덕면 일주서로 1611,2023,05,160,29,31,30,21,22,13,14
c1,관광지,건강장수마을 산양리 농어촌체험마을,제주시 한경면 중산간서로 3169,2023,05,58,9,8,11,7,10,7,6
c1,관광지,걸매생태공원,제주특별자치도 서귀포시 남성로 (서홍동),2023,05,143,30,16,15,13,22,23,24
c1,관광지,걸매예술마을,제주특별자치도 서귀포시 서홍로 4-42,2023,05,82,14,20,11,9,10,10,8
c1,관광지,걸서악오름,제주특별자치도 서귀포시 남원읍 하례로 393-1,2023,05,42,6,8,5,9,6,6,2
c1,관광지,검멀레동굴,제주특별자치도 제주시 우도면,2023,05,162,29,27,28,16,18,18,26
c1,관광지,검멀레해변,제주특별자치도 제주시 우도면 우도해안길,2023,05,388,83,82,63,46,32,27,55
c1,관광지,게우지코지,제주특별자치도 서귀포시 하효동,2023,05,119,20,14,23,16,16,18,12
c1,관광지,겨울이네,제주특별자치도 제주시 아란4길 91,2023,05,47,9,8,5,6,4,10,5
c1,관광지,고근산(고공산),제주특별자치도 서귀포시 고근산로202번길 48,2023,05,111,24,18,14,12,16,9,18
c1,관광지,고내리 다락쉼터,제주특별자치도 제주시 애월읍 애월해안로 284,2023,05,77,15,16,5,11,9,12,9
c1,관광지,고내리포구,제주특별자치도 제주시 애월읍 고내리,2023,05,61,7,12,9,15,5,6,7
c1,관광지,"고내봉(고내오름,고니오름,망오름)",제주특별자치도 제주시 애월읍 고내리 산 3-1,2023,05,105,18,19,14,16,9,17,12
c1,관광지,고사리숲,제주특별자치도 제주시 애월읍 평화로 2715 제주관광대학교 내 창업보육센터 본관 315호,2023,05,69,8,16,14,10,6,6,9
c1,관광지,고산일과해안도로,제주특별자치도 서귀포시 대정읍 영락하동로 9-6,2023,05,71,17,10,14,7,8,10,5
c1,관광지,고살리숲길,제주특별자치도 서귀포시 남원읍 하례리 산 54-2,2023,05,313,48,48,53,44,36,39,45
c1,관광지,고씨주택,제주특별자치도 제주시 관덕로17길 27-1,2023,05,73,4,14,18,12,12,4,9
c1,관광지,고요산책,제주특별자치도 제주시 중앙로12길 5,2023,05,63,10,11,12,9,7,6,8
c1,관광지,고포잇다이브센터,제주특별자치도 서귀포시 이어도로 685-1,2023,05,66,11,9,10,11,6,11,8
c1,관광지,고흐의 정원,제주특별자치도 서귀포시 성산읍 삼달신풍로 126-5,2023,05,126,21,19,22,21,14,14,15
c1,관광지,곤물,제주특별자치도 서귀포시 안덕면 화순서서로64번길 64-4,2023,05,27,5,6,4,4,2,3,3
c1,관광지,곤흘동(곤을동) 마을터,제주특별자치도 제주시 화북1동 4438,2023,05,132,18,32,17,23,13,20,9
c1,관광지,골프탕탕,제주특별자치도 서귀포시 안덕면 산록남로 762번길 71,2023,05,45,9,8,10,5,5,4,4
c1,관광지,곱닥한개,제주특별자치도 제주시 설촌로10길 12,2023,05,40,7,9,6,7,3,5,3
c1,관광지,공방:하루_반,제주특별자치도 제주시 구좌읍 월정7길 42-6 1층,2023,05,58,10,10,6,7,9,7,9
c1,관광지,공천포,제주특별자치도 서귀포시 남원읍 신례리,2023,05,72,14,12,9,12,9,7,9
c1,관광지,공천포구,제주특별자치도 서귀포시 남원읍 신례리,2023,05,58,6,13,5,7,10,8,9
c1,관광지,곶자왈,제주특별자치도 서귀포시 대정읍 신평리,2023,05,222,54,52,20,23,24,28,21
c1,관광지,곽지패총,제주특별자치도 제주시 애월읍 곽지리 2043-1,2023,05,46,8,12,2,7,5,5,7
c1,관광지,곽지해수욕장,제주특별자치도 제주시 애월읍 애월원당길 (곽지리),2023,05,1437,253,275,218,204,164,137,186
c1,관광지,곽지해수욕장야영장,제주특별자치도 제주시 애월읍 곽지리 1565,2023,05,134,22,23,22,15,20,18,14
c1,관광지,관덕정,제주특별자치도 제주시 관덕로 19,2023,05,745,143,130,169,87,67,64,85
c1,관광지,관음사,제주특별자치도 제주시 산록북로 660,2023,05,190,32,34,30,31,24,17,22
c1,관광지,관음사 군 주둔지 옛터,제주특별자치도 제주시 산록북로 660,2023,05,45,9,8,4,6,4,11,3
c1,관광지,관음사 야영장,제주특별자치도 제주시 산록북로 588,2023,05,180,37,27,29,22,21,22,22
c1,관광지,관음사 템플스테이,제주시 산록북로 660,2023,05,86,15,18,9,14,10,12,8
c1,관광지,광령귤나무,제주특별자치도 제주시 애월읍 광령8길 24-2,2023,05,41,7,6,6,6,6,5,5
c1,관광지,광치기해변,제주특별자치도 서귀포시 성산읍 섭지코지로 63,2023,05,1142,229,197,163,133,113,108,199
c1,관광지,교래자연휴양림,제주특별자치도 제주시 조천읍 남조로 2023,2023,05,267,61,44,44,38,31,27,22
c1,관광지,구엄리돌염전,제주특별자치도 제주시 애월읍 애월해안로 708,2023,05,435,84,75,69,57,43,54,53
c1,관광지,구엄포구,제주특별자치도 제주시 애월읍 구엄리,2023,05,69,11,16,10,10,5,11,6
c1,관광지,구좌 하도어촌계,제주특별자치도 제주시 구좌읍 해맞이해안로 1897-27,2023,05,116,16,17,20,20,19,13,11
c1,관광지,구좌해안로,제주특별자치도 제주시 구좌읍 구좌해안로,2023,05,74,10,17,6,12,10,11,8
c1,관광지,국립제주박물관,제주특별자치도 제주시 일주동로 17,2023,05,295,46,52,55,46,36,30,30
c1,관광지,"군산(군산오름,코메오름)",제주특별자치도 서귀포시 안덕면 창천리 산 3-1,2023,05,431,86,68,64,53,60,44,56
c1,관광지,굴동포구,제주특별자치도 제주시 구좌읍 해맞이해안로,2023,05,71,13,16,10,9,6,8,9
c1,관광지,굿다이버,제주특별자치도 서귀포시 중산간서로 41 (강정동),2023,05,37,7,7,8,10,1,1,3
c1,관광지,궁대오름(궁대악),제주특별자치도 서귀포시 성산읍 금백조로 446,2023,05,62,14,12,12,11,6,3,4
c1,관광지,귀덕연대,제주특별자치도 제주시 한림읍 귀덕14길 14-5,2023,05,35,6,13,4,5,0,3,4
c1,관광지,귀빈사,제주특별자치도 제주시 구좌읍 비자림로 1456,2023,05,66,14,13,12,7,4,7,9
c1,관광지,귤밭76번지,제주특별자치도 서귀포시 안덕면 병악로 76,2023,05,162,29,34,28,25,16,16,14
c1,관광지,귤빛캠핑장,제주특별자치도 제주시 조천읍 함와로 428,2023,05,99,16,19,17,13,8,10,16
c1,관광지,그랑블루 요트투어,제주특별자치도 서귀포시 대포로 174,2023,05,175,35,32,33,23,22,11,19
c1,관광지,그랑블루호(선상낚시),제주특별자치도 서귀포시 남원읍 위미중앙로180번길 10,2023,05,67,13,11,17,7,3,5,11
c1,관광지,그루밍시즌,제주특별자치도 서귀포시 동홍로 29,2023,05,42,7,9,8,4,2,6,6
c1,관광지,그루밍제주,제주특별자치도 서귀포시 천제연로 357,2023,05,52,10,11,6,8,7,6,4
c1,관광지,그리스신화박물관 / 트릭아이미술관,제주특별자치도 제주시 한림읍 광산로 942,2023,05,136,29,19,21,26,20,10,11
c1,관광지,그린크루즈(산방산유람선),제주특별자치도 서귀포시 안덕면 화순해안로106번길 16,2023,05,115,16,18,21,22,16,9,13
c1,관광지,그제바람 윈드서핑패들보드,제주특별자치도 제주시 선사로8길 13-4,2023,05,95,11,12,9,21,15,15,12
c1,관광지,금능석물원,제주특별자치도 제주시 한림읍 한림로 176,2023,05,170,31,31,32,20,22,18,16
c1,관광지,금능포구,제주특별자치도 제주시 한림읍 금능리,2023,05,59,10,7,14,7,7,3,11
c1,관광지,금능해수욕장,제주특별자치도 제주시 한림읍 금능길 119-10,2023,05,1414,250,264,232,175,176,151,166
c1,관광지,금덕무환자나무및팽나무군락,제주특별자치도 제주시 애월읍 유수암리 1920,2023,05,49,2,9,7,7,7,8,9
c1,관광지,금룡사,제주특별자치도 제주시 구좌읍 김녕로 148-11,2023,05,53,7,11,10,5,7,7,6
c1,관광지,금룡사 템플스테이,제주특별자치도 제주시 구좌읍 김녕로 148-11,2023,05,74,17,14,7,10,4,9,13
c1,관광지,금붕사,제주특별자치도 제주시 구좌읍 일주동로 3618-1,2023,05,87,15,15,7,16,8,18,8
c1,관광지,금성포구,제주특별자치도 제주시 애월읍 금성리 573-1,2023,05,57,6,15,9,11,5,5,6
c1,관광지,금악오름(왕매),제주특별자치도 제주시 한림읍 금악리 산 1-1,2023,05,457,81,81,71,61,55,58,50
c1,관광지,기독교순례길 1코스(순종의길),제주특별자치도 제주시 애월읍 금성하안길 3,2023,05,131,15,32,14,12,17,26,15
c1,관광지,기독교순례길 2코스(순교의길),제주특별자치도 제주시 한림읍 협재8길 8,2023,05,98,5,15,19,9,20,19,11
c1,관광지,기독교순례길 3코스(사명의길),제주특별자치도 제주시 한경면 조수3길 7,2023,05,94,7,19,17,11,16,15,9
c1,관광지,기독교순례길 4코스(화해의길),제주특별자치도 서귀포시 대정읍 추사로36번길 11,2023,05,92,13,20,16,10,10,19,4
c1,관광지,김경숙해바라기농장,제주특별자치도 제주시 번영로 854-1,2023,05,513,91,91,94,77,53,46,61
c1,관광지,김녕 지질트레일,제주특별자치도 제주시 구좌읍 김녕로 209,2023,05,327,60,60,57,39,48,30,33
c1,관광지,김녕 청굴물,제주특별자치도 제주시 구좌읍 김녕리 1296,2023,05,154,28,34,25,16,23,16,12
c1,관광지,김녕금속공예벽화마을,제주특별자치도 제주시 구좌읍 김녕항3길 18-16,2023,05,119,19,18,25,16,12,12,17
c1,관광지,김녕사굴,제주특별자치도 제주시 구좌읍 덕천리 201-4,2023,05,286,52,51,42,54,29,28,30
c1,관광지,김녕요트투어,제주특별자치도 제주시 구좌읍 구좌해안로 229-16,2023,05,184,31,29,34,27,17,25,21
c1,관광지,김녕항,제주특별자치도 제주시 구좌읍 김녕항1길 50-13,2023,05,88,15,14,13,17,15,8,6
c1,관광지,김녕해수욕장,제주특별자치도 제주시 구좌읍 구좌해안로 237,2023,05,1798,319,297,277,241,238,213,213
c1,관광지,김녕해수욕장야영장,제주특별자치도 제주시 구좌읍 해맞이해안로 7-6,2023,05,260,48,45,46,30,31,24,36
c1,관광지,김녕해안도로,제주특별자치도 제주시 구좌읍 김녕리,2023,05,140,24,26,16,20,18,19,17
c1,관광지,김만덕객주,제주특별자치도 제주시 임항로 68,2023,05,154,21,27,31,17,18,21,19
c1,관광지,김만덕기념관,제주특별자치도 제주시 산지로 7,2023,05,105,19,19,15,19,16,10,7
c1,관광지,김서프제주,제주특별자치도 서귀포시 색달로81번길 39,2023,05,49,9,10,8,5,8,3,6
c1,관광지,김영갑갤러리 두모악,제주특별자치도 서귀포시 성산읍 삼달로 137,2023,05,210,50,36,36,31,19,20,18
c1,관광지,김영수도서관,제주특별자치도 제주시 중앙로8길 18,2023,05,83,13,23,8,16,6,7,10
c1,관광지,김택화미술관,제주특별자치도 제주시 조천읍 신흥로 1,2023,05,90,20,19,12,9,11,8,11
c1,관광지,김한미술관 & 카페3206,제주특별자치도 제주시 한림읍 한상로 115,2023,05,80,17,17,13,13,5,7,8
c1,관광지,까끄래기오름,제주시 조천읍 교래리 128,2023,05,54,8,11,9,6,7,8,5
c1,관광지,꽃썸,서귀포시 안덕면 동광로 151,2023,05,59,8,10,11,8,8,8,6
c1,관광지,꿈바당 어린이도서관,제주특별자치도 제주시 연오로 140,2023,05,71,12,6,11,13,9,13,7
c1,관광지,나바론절벽,제주특별자치도 제주시 추자면 영흥리 산 19,2023,05,93,20,13,9,11,22,11,7
c1,관광지,나틸다,제주특별자치도 제주시 아란5길 31-6,2023,05,26,2,3,6,3,5,5,2
c1,관광지,낙선동 4.3성,제주특별자치도 제주시 조천읍 선흘서5길 13,2023,05,122,26,21,28,19,9,13,6
c1,관광지,낙천리아홉굿의자마을,제주시 한경면 낙수로 97,2023,05,112,22,24,11,18,9,12,16
c1,관광지,낙천아홉굿마을 의자공원,제주특별자치도 제주시 한경면 낙수로 97,2023,05,91,19,19,14,10,12,9,8
c1,관광지,낙타트래킹,제주특별자치도 서귀포시 표선면 번영로 2564-21,2023,05,167,26,22,40,18,28,16,17
c1,관광지,남내소,제주특별자치도 서귀포시 남원읍 하례로,2023,05,77,16,18,10,9,10,7,7
c1,관광지,남두연대,제주특별자치도 제주시 애월읍 신엄리 2780-1,2023,05,35,7,6,7,4,3,5,3
c1,관광지,남문지못,제주특별자치도 서귀포시 대정읍 인성리 392,2023,05,29,7,4,7,3,3,2,3
c1,관광지,남수각 하늘길 벽화거리,제주특별자치도 제주시 중앙로13길 32,2023,05,58,10,10,6,7,2,8,15
c1,관광지,남원 위미2리 어촌계,제주특별자치도 서귀포시 남원읍 태위로 208,2023,05,78,17,10,9,12,9,10,11
c1,관광지,남원큰엉해변,제주특별자치도 서귀포시 남원읍 태위로 522-17,2023,05,406,91,70,60,65,40,43,37
c1,관광지,남원항 (남원포구),제주특별자치도 서귀포시 남원읍 남태해안로 140,2023,05,79,15,10,13,10,9,15,7
c1,관광지,납읍난대림 금산공원,제주특별자치도 제주시 애월읍 납읍리 14 57,2023,05,149,24,32,24,22,19,15,13
c1,관광지,내창트레킹,제주특별자치도 서귀포시 남원읍 하례중앙로 95,2023,05,142,19,26,24,13,21,24,15
c1,관광지,너븐숭이 4.3기념관,제주특별자치도 제주시 조천읍 북촌3길 3,2023,05,436,63,115,85,59,50,28,36
c1,관광지,넥슨컴퓨터박물관,제주특별자치도 제주시 1100로 3198-8,2023,05,262,41,69,47,45,25,12,23
c1,관광지,노루생태관찰원,제주특별자치도 제주시 명림로 520,2023,05,136,12,38,25,11,16,19,15
c1,관광지,노리매공원,제주특별자치도 서귀포시 대정읍 중산간서로 2260-15,2023,05,229,39,50,27,36,28,22,27
c1,관광지,노을승마장,제주특별자치도 제주시 우도면 우도해안길 406-1,2023,05,88,21,12,18,2,9,14,12
c1,관광지,노을해안1014,제주특별자치도 제주시 한경면 노을해안로 1014,2023,05,127,23,25,16,25,17,7,14
c1,관광지,노을해안로,제주특별자치도 서귀포시 대정읍 노을해안로 24,2023,05,165,29,26,25,19,27,13,26
c1,관광지,노형수퍼마켙,제주특별자치도 제주시 노형로 89,2023,05,435,69,102,64,73,52,33,42
c1,관광지,녹산로유채꽃길,제주특별자치도 서귀포시 표선면 가시리 산 87-15,2023,05,343,58,61,67,40,35,37,45
c1,관광지,논짓물,제주특별자치도 서귀포시 하예동,2023,05,649,109,136,129,80,47,74,74
c1,관광지,놀멍쉬멍고르멍(애견카페),제주특별자치도 서귀포시 현청로 51,2023,05,54,11,6,6,12,8,4,7
c1,관광지,놀자개,제주특별자치도 제주시 오광로 143,2023,05,49,9,8,8,5,6,4,9
c1,관광지,농개,제주특별자치도 서귀포시 성산읍 환해장성로111번길 4,2023,05,59,10,10,9,11,5,6,8
c1,관광지,높은오름,제주특별자치도 제주시 구좌읍 송당리 산 213-1,2023,05,86,21,8,12,11,14,12,8
c1,관광지,누운오름(한림읍),제주특별자치도 제주시 한림읍 금악리 188-2,2023,05,69,17,13,7,7,6,11,8
c1,관광지,누웨마루거리(구 바오젠),제주특별자치도 제주시 신광로 47,2023,05,193,34,32,34,22,29,22,20
c1,관광지,눈물의십자가,제주특별자치도 제주시 추자도,2023,05,100,19,16,11,8,13,16,17
c1,관광지,느지리오름(망오름),제주특별자치도 제주시 한림읍 상명리 산 5,2023,05,83,12,12,14,12,14,12,7
c1,관광지,다끄네포구(용담포구),제주특별자치도 제주시 용담3동,2023,05,92,12,19,12,20,13,7,9
c1,관광지,다랑쉬굴,제주특별자치도 제주시 구좌읍 세화리 2608-6,2023,05,259,31,56,50,24,42,29,27
c1,관광지,다랑쉬마을,제주특별자치도 제주시 구좌읍 다랑쉬로 406-25,2023,05,111,16,23,12,17,19,12,12
c1,관광지,다랑쉬오름(월랑봉),제주특별자치도 제주시 구좌읍 세화리 2705,2023,05,1398,232,216,341,173,185,124,127
c1,관광지,다려도,제주특별자치도 제주시 조천읍 북촌리,2023,05,83,12,16,8,19,6,10,12
c1,관광지,다이나믹메이즈,제주특별자치도 서귀포시 표선면 번영로 2644,2023,05,578,108,88,86,75,85,68,68
c1,관광지,단산(바굼지오름),제주특별자치도 서귀포시 안덕면 향교로 165-23,2023,05,168,35,23,24,26,24,15,21
c1,관광지,단산과 방사탑,제주특별자치도 제주시 조천읍 신흥로1길 25,2023,05,55,12,14,5,6,6,9,3
c1,관광지,닭머르해안길,제주특별자치도 제주시 조천읍 신촌북3길 62-1,2023,05,859,170,153,128,97,89,101,121
c1,관광지,답다니 탑망대 (하트원담),제주특별자치도 제주시 우도면 연평리 798,2023,05,99,20,16,17,10,9,11,16
c1,관광지,"당산봉(당오름,차귀오름)",제주특별자치도 제주시 한경면 고산리 산 15,2023,05,145,29,28,17,22,21,17,11
c1,관광지,당오름,제주특별자치도 제주시 구좌읍 송당리 산 199-1,2023,05,83,13,21,12,8,6,10,13
c1,관광지,당오름(안덕면),제주특별자치도 서귀포시 안덕면 동광리 산 68-1,2023,05,70,15,18,11,6,6,5,9
c1,관광지,당오름(한경면),제주특별자치도 제주시 한경면 용수리 산 18,2023,05,78,11,14,11,14,9,10,9
c1,관광지,당케산물(당케포구),제주특별자치도 서귀포시 표선면 표선당포로,2023,05,84,14,18,17,7,7,10,11
c1,관광지,대림리선돌,제주특별자치도 제주시 한림읍 대림리,2023,05,43,11,4,4,11,5,4,4
c1,관광지,"대수산봉(큰물뫼,물미오름)",제주특별자치도 서귀포시 성산읍 고성리 2039-1,2023,05,63,13,7,12,8,1,16,6
c1,관광지,대수포구,제주특별자치도 제주시 한림읍 수원리 1027-7,2023,05,48,7,7,7,9,5,5,8
c1,관광지,"대왕산 (왕뫼, 왕메, 왕미)",제주특별자치도 서귀포시 성산읍 수산리 1429,2023,05,38,4,6,13,6,2,3,4
c1,관광지,대유ATV수렵사격랜드,제주특별자치도 서귀포시 상예로 381,2023,05,83,8,16,12,14,13,8,12
c1,관광지,대장금촬영지(제주민속촌),제주특별자치도 서귀포시 표선면 민속해안로 631-34,2023,05,120,14,25,24,15,14,14,14
c1,관광지,대정면 4.3사건 위령비,제주특별자치도 서귀포시 대정읍 동일하모로 158-3,2023,05,75,16,10,24,9,3,5,8
c1,관광지,대정해변(하모해변),제주특별자치도 서귀포시 대정읍 하모리,2023,05,123,18,18,25,14,20,18,10
c1,관광지,대정향교,제주특별자치도 서귀포시 안덕면 향교로 165-17,2023,05,128,22,17,24,16,18,14,17
c1,관광지,대정현역사자료전시관,제주특별자치도 서귀포시 대정읍 상모대서로 17,2023,05,65,9,12,6,19,15,2,2
c1,관광지,대평포구,제주특별자치도 서귀포시 안덕면 감천로190번길 9-62-2,2023,05,134,29,26,23,9,17,12,18
c1,관광지,대포포구,제주특별자치도 서귀포시 대포로,2023,05,89,18,18,12,10,14,10,7
c1,관광지,대한민국최남단기념비/ 마라도 기념비,제주특별자치도 서귀포시 대정읍 마라로 131,2023,05,84,13,15,20,6,11,10,9
c1,관광지,댕댕놀이터,제주특별자치도 제주시 도근내길 56,2023,05,47,10,9,8,7,5,3,5
c1,관광지,댕댕샤워,제주특별자치도 제주시 애월읍 하귀9길 54-8,2023,05,55,11,11,8,6,9,7,3
c1,관광지,더 플래닛(THE PLANET),제주특별자치도 서귀포시 천제연로 70,2023,05,105,15,27,15,18,6,15,9
c1,관광지,"더럭초등학교(구, 더럭분교)",제주특별자치도 제주시 애월읍 하가로 195,2023,05,330,58,65,56,45,35,35,36
c1,관광지,더마카트,제주특별자치도 제주시 한림읍 월림7길 155,2023,05,119,23,18,16,16,15,15,16
c1,관광지,더마파크,제주특별자치도 제주시 한림읍 월림7길 155,2023,05,400,71,78,74,59,49,28,41
c1,관광지,더펫츠,제주특별자치도 제주시 1100로 3124,2023,05,60,7,7,7,19,5,9,6
c1,관광지,더힐하우스스파,제주특별자치도 제주시 한림읍 한창로 925-122,2023,05,63,10,15,8,10,6,5,9
c1,관광지,덕천리 팔자 좋아 길,제주특별자치도 제주시 구좌읍 중산간동로,2023,05,177,26,22,14,15,11,51,38
c1,관광지,도곤도곤 애견미용실,제주특별자치도 제주시 성신로1길 21,2023,05,53,9,17,4,8,3,3,9
c1,관광지,도그앤캣,제주특별자치도 서귀포시 홍중로 119-2  601동 107호,2023,05,40,6,8,6,7,3,8,2
c1,관광지,도도펫,제주특별자치도 제주시 우령8길 63-16,2023,05,35,6,5,3,9,5,4,3
c1,관광지,도두동 무지개 해안도로,제주특별자치도 제주시 도두1동,2023,05,822,149,135,126,116,114,87,95
